<?xml version="1.0" encoding="UTF-8"?>
<Bands xmlns:xsi="http://www.w3.org/2001/XMLSchema-instance" xsi:noNamespaceSchemaLocation="schema.xsd">
    <Band JestKultowy="true">
        <Members>
            <Member role="Wokalista" JestKultowy="true">
                <Name>Emily Armstrong</Name>
                <Instruments>
                    <Instrument>Wokal prowadzący</Instrument>
                </Instruments>
                <YearsActive>2024-Present</YearsActive>
                <Photo>emily_armstrong.jpg</Photo>
            </Member>
            <Member role="Wokalista, Rap, Gitara rytmiczna, Keyboard, Programowanie" JestKultowy="true">
                <Name>Mike Shinoda</Name>
                <Instruments>
                    <Instrument>Wokal wspierający</Instrument>
                    <Instrument>Rap</Instrument>
                    <Instrument>Gitara rytmiczna</Instrument>
                    <Instrument>Keyboard</Instrument>
                    <Instrument>Programowanie</Instrument>
                </Instruments>
                <YearsActive>1996-Present</YearsActive>
                <Photo>mike_shinoda.jpg</Photo>
            </Member>
            <Member role="Gitara prowadząca, Gitara rytmiczna, Programowanie" JestKultowy="true">
                <Name>Brad Delson</Name>
                <Instruments>
                    <Instrument>Gitara prowadząca</Instrument>
                    <Instrument>Gitara rytmiczna</Instrument>
                    <Instrument>Programowanie</Instrument>
                </Instruments>
                <YearsActive>1996-Present</YearsActive>
                <Photo>brad_delson.jpg</Photo>
            </Member>
            <Member role="Gitara basowa" JestKultowy="true">
                <Name>Dave Farrell</Name>
                <Instruments>
                    <Instrument>Gitara basowa</Instrument>
                </Instruments>
                <YearsActive>1996-Present</YearsActive>
                <Photo>dave_farrell.jpg</Photo>
            </Member>
            <Member role="DJ, Turnatablizm, Instrumenty klawiszowe" JestKultowy="true">
                <Name>Joe Hahn</Name>
                <Instruments>
                    <Instrument>DJ</Instrument>
                    <Instrument>Turnatablizm</Instrument>
                    <Instrument>Instrumenty klawiszowe</Instrument>
                </Instruments>
                <YearsActive>1996-Present</YearsActive>
                <Photo>joe_hahn.jpg</Photo>
            </Member>
            <Member role="Perkusja" JestKultowy="false">
                <Name>Collin Brittain</Name>
                <Instruments>
                    <Instrument>Perkusja</Instrument>
                </Instruments>
                <YearsActive>2024-Present</YearsActive>
                <Photo>collin_brittain.jpg</Photo>
            </Member>

            <Member role="Wokalista" JestKultowy="true">
                <Name>Chester Bennington</Name>
                <Instruments>
                    <Instrument>Wokal prowadzący</Instrument>
                </Instruments>
                <YearsActive>1999-2017</YearsActive>
                <Photo>chester_bennington.jpg</Photo>
            </Member>
            <Member role="Perkusja, Instrumenty perkusyjne" JestKultowy="true">
                <Name>Rob Bourdon</Name>
                <Instruments>
                    <Instrument>Perkusja</Instrument>
                    <Instrument>Instrumenty perkusyjne</Instrument>
                </Instruments>
                <YearsActive>1996-2024</YearsActive>
                <Photo>rob_bourdon.jpg</Photo>
            </Member>
            <Member role="Wokalista" JestKultowy="false">
                <Name>Mark Wakefield</Name>
                <Instruments>
                    <Instrument>Wokal prowadzący</Instrument>
                </Instruments>
                <YearsActive>1996-1998</YearsActive>
                <Photo>mark_wakefield.jpg</Photo>
            </Member>
        </Members>
        <Albums>
            <Album EPka="false" JestKultowy="true">
                <Title>Hybrid Theory</Title>
                <Year>2000</Year>
                <Cover>cover_hybrid_theory.jpg</Cover>
            </Album>
            <Album EPka="false" JestKultowy="true">
                <Title>Meteora</Title>
                <Year>2003</Year>
                <Cover>cover_meteora.jpg</Cover>
            </Album>
            <Album EPka="false" JestKultowy="false">
                <Title>Minutes to Midnight</Title>
                <Year>2007</Year>
                <Cover>cover_minutes_to_midnight.jpg</Cover>
            </Album>
            <Album EPka="false" JestKultowy="false">
                <Title>A Thousand Suns</Title>
                <Year>2010</Year>
                <Cover>cover_a_thousand_suns.jpg</Cover>
            </Album>
            <Album EPka="false" JestKultowy="false">
                <Title>Living Things</Title>
                <Year>2012</Year>
                <Cover>cover_living_things.jpg</Cover>
            </Album>
            <Album EPka="false" JestKultowy="false">
                <Title>The Hunting Party</Title>
                <Year>2014</Year>
                <Cover>cover_the_hunting_party.jpg</Cover>
            </Album>
            <Album EPka="false" JestKultowy="false">
                <Title>One More Light</Title>
                <Year>2017</Year>
                <Cover>cover_one_more_light.jpg</Cover>
            </Album>
            <Album EPka="false" JestKultowy="false">
                <Title>From Zero</Title>
                <Year>2024</Year>
                <Cover>cover_from_zero.jpg</Cover>
            </Album>
        </Albums>
        <Genre>Nu-Metal</Genre>
        <Description>Linkin Park - amerykański zespół muzyczny wykonujący szeroko pojętą muzykę rockową i metalową. Powstał w 1996 roku w Agoura Hills w Kalifornii, a sławę zyskał w 2000 roku po wydaniu pierwszego albumu, Hybrid Theory. Od tego czasu Linkin Park stali się jedną z najpopularniejszych grup w historii muzyki.</Description>
        <Page>https://www.linkinpark.com</Page>
        <YouTube>https://www.youtube.com/user/linkinpark</YouTube>

    </Band>
</Bands>
